{
  "$schema": "../../../schemas/plugin.schema.json",
  "schemaVersion": 1,
  "name": "emergency-studio",
  "version": "1.0.0",
  "description": "应急、消防、危化与安全生产领域的内容创作工作室：文章撰写与知识图谱出图两大技能，从选题、调研、成稿、出图到发布文案闭环。",
  "author": {
    "name": "leinatorX",
    "url": "https://github.com/leinatorX"
  },
  "homepage": "https://github.com/leinatorX/looma-marketplace/tree/main/plugins/emergency-studio",
  "repository": "https://github.com/leinatorX/looma-marketplace",
  "license": "MIT",
  "keywords": [
    "emergency",
    "safety",
    "wechat",
    "article",
    "knowledge-graph",
    "fire",
    "chemical",
    "content",
    "looma"
  ],
  "skills": "./skills/",
  "interface": {
    "displayName": "应急科普内容工作室",
    "shortDescription": "应急安全公众号文章 + 知识图谱出图，从选题到发布闭环。",
    "category": "编辑",
    "brandColor": "#E11D48"
  }
}
